{
  "schema": "ores.faas.tenant-host-isolation-evidence/v1",
  "platform": "fixture",
  "runtime_id": "tenant-a:revision-17",
  "artifact_sha256": "0123456789abcdef0123456789abcdef0123456789abcdef0123456789abcdef",
  "kernel_boundary": "microvm",
  "cgroup_v2": true,
  "identity_bound_containment": true,
  "non_root": true,
  "capabilities_empty": true,
  "no_new_privs": true,
  "seccomp": true,
  "filesystem_restriction": "microvm_guest",
  "pid_isolation": true,
  "mount_isolation": true,
  "ipc_isolation": true,
  "network_isolation": true,
  "resource_limits": { "cpu": true, "memory": true, "pids": true, "io": true },
  "metadata_denied": true,
  "sibling_tenant_default_deny": true,
  "egress_policy": "allowlist",
  "containment_receipt_redacted": true,
  "host_attestation_source": "microvm_supervisor",
  "microvm_required": true
}
